{
  "schema_version": "cacp.community_evidence.v0.1",
  "evidence_id": "evidence-elder-walk-resident-notice",
  "evidence_type": "resident_notice",
  "contract_id": "ctc-elder-friendly-walking-helper",
  "recorded_by": "actor-community-operator-console",
  "recorded_at": "2026-06-24T08:01:00Z",
  "facts": { "notice_recorded": true, "opt_out_available": true, "real_identity_stored": false },
  "source_artifact_ids": ["artifact-elder-walk-resident-notice"],
  "synthetic": true,
  "data_policy": "fictional_or_synthetic_only"
}
