{
  "schema_version": "cacp.community_evidence.v0.1",
  "evidence_id": "evidence-playground-repair-resident-notice",
  "evidence_type": "resident_notice",
  "contract_id": "ctc-temporary-playground-repair-notice",
  "recorded_by": "actor-community-operator-console",
  "recorded_at": "2026-06-25T02:01:00Z",
  "facts": {
    "notice_recorded": true,
    "repair_window_posted_before_scheduling": true,
    "alternate_route_described": true,
    "operator_contact_available": true,
    "real_identity_stored": false
  },
  "source_artifact_ids": ["artifact-playground-repair-resident-notice"],
  "synthetic": true,
  "data_policy": "fictional_or_synthetic_only"
}
