{
  "schema_version": "cacp.community_evidence.v0.1",
  "evidence_id": "evidence-ai-garden-meetup-operator-review",
  "evidence_type": "operator_approval",
  "contract_id": "ctc-ai-suggested-garden-meetup",
  "recorded_by": "actor-community-operator-console",
  "recorded_at": "2026-06-24T11:01:00Z",
  "facts": {
    "operator_review_required": true,
    "resident_contact_started": false,
    "real_identity_used": false,
    "ai_can_self_approve": false
  },
  "source_artifact_ids": ["artifact-ai-garden-meetup-review-record"],
  "synthetic": true,
  "data_policy": "fictional_or_synthetic_only"
}
